{"schemaVersion":1,"slug":"enshrouded","game":{"displayName":"Enshrouded Dedicated Server","appId":2278520},"transport":"none","sources":[{"url":"https://www.gameserverkings.com/knowledge-base/enshrouded/how-to-add-admins-and-commands/","kind":"community","retrievedAt":"2026-09-10"},{"url":"https://enshrouded.featureupvote.com/suggestions/523356/common-dedicated-server-management-functions","kind":"forum","retrievedAt":"2026-09-10"}],"confidence":"high","researchedAt":"2026-09-10","verifiedAt":null,"notes":"No console, no chat commands, no RCON. The server window accepts no input. Kick and ban happen in-game from the player list, by a role with canKickBan in enshrouded_server.json; bans persist in that file's bannedAccounts array. A 445-vote request for RCON and remote player listing has stood since Jan 2024 with no developer response. One hosting site (supercraft.host) documents /kick and /ban chat commands; they do not exist."}
